{
    "schemaVersion": 1,
    "id": "independent-flight-matrix-rk4-v1",
    "modelVersion": "2026.08.11",
    "reference": {
        "implementation": "validation/reference/generate-flight-matrix.mjs",
        "integrator": "fixed-time classical RK4 over [x, y, z, vx, vy, vz]",
        "stepS": 0.00002,
        "rangeInterpolation": "linear interpolation across the fixed RK4 step",
        "dragSources": [
            "validation/sources/g1-gnu-ballistics.csv",
            "validation/sources/g7-py-ballisticcalc-2.2.10.csv",
            "Morrison sphere correlation with Collins compressibility correction and bisection inversion"
        ],
        "atmosphereModel": "independent JavaScript transcription of the declared production formulas",
        "generatedAt": "2026-08-18"
    },
    "scenarios": [
        {
            "id": "cold-dense-strong-headwind-g1",
            "category": "environment",
            "projectile": {
                "id": "builtin:federal-sp-150",
                "massKg": 0.0097198365,
                "muzzleVelocityMps": 859.536,
                "dragModel": "G1",
                "ballisticCoefficient": 0.312368144835017,
                "sphereDiameterM": 0,
                "materialDensityKgM3": 0,
                "dragReferenceDiameterM": 0,
                "machCdPoints": []
            },
            "atmosphere": {
                "temperatureC": -40,
                "stationPressureHpa": 1080,
                "relativeHumidityPercent": 20,
                "headwindMps": 25,
                "crosswindMps": -10,
                "densityKgM3": 1.6136632735318421,
                "speedOfSoundMps": 306.2726518710642,
                "dynamicViscosityPaS": 0.000015108086919615961
            },
            "launch": {
                "elevationRad": 0.04,
                "azimuthRad": 0.02
            },
            "maximumDistanceM": 1200,
            "tolerances": {
                "positionAbsoluteM": 0.0005,
                "velocityAbsoluteMps": 0.005,
                "timeAbsoluteS": 0.000015,
                "scalarAbsolute": 0.005,
                "dragCoefficientAbsolute": 0.000002
            },
            "samples": [
                {
                    "distanceM": 100,
                    "timeS": 0.1261549139336529,
                    "positionM": {
                        "x": 100,
                        "y": 3.938191165787759,
                        "z": 1.910755293140817
                    },
                    "groundVelocityMps": {
                        "x": 732.2318018461743,
                        "y": 28.30598053627654,
                        "z": 13.287247827728542
                    },
                    "groundSpeedMps": 732.8991684562417,
                    "airspeedMps": 758.1184117093543,
                    "mach": 2.475305604590872,
                    "dragCoefficient": 0.5312154326334245
                },
                {
                    "distanceM": 300,
                    "timeS": 0.45276245576492014,
                    "positionM": {
                        "x": 300,
                        "y": 11.251553507907415,
                        "z": 5.046410920663553
                    },
                    "groundVelocityMps": {
                        "x": 512.0898702800879,
                        "y": 17.351232138407333,
                        "z": 6.517194450208517
                    },
                    "groundSpeedMps": 512.4251890019654,
                    "airspeedMps": 537.6238571033734,
                    "mach": 1.755376635226655,
                    "dragCoefficient": 0.6155852595646223
                },
                {
                    "distanceM": 600,
                    "timeS": 1.262299191692979,
                    "positionM": {
                        "x": 600,
                        "y": 18.914156997260783,
                        "z": 6.799377182623371
                    },
                    "groundVelocityMps": {
                        "x": 280.24215421894627,
                        "y": 3.5670350859058404,
                        "z": -0.6128484363227958
                    },
                    "groundSpeedMps": 280.2655246793398,
                    "airspeedMps": 305.4072937341322,
                    "mach": 0.9971745497626203,
                    "dragCoefficient": 0.46620566928103424
                },
                {
                    "distanceM": 900,
                    "timeS": 2.6100480092130627,
                    "positionM": {
                        "x": 900,
                        "y": 15.115884812145278,
                        "z": 3.584015277681502
                    },
                    "groundVelocityMps": {
                        "x": 166.69787137365847,
                        "y": -8.173071555316444,
                        "z": -4.104690495244977
                    },
                    "groundSpeedMps": 166.9485786199417,
                    "airspeedMps": 191.96256838768565,
                    "mach": 0.62677019059638,
                    "dragCoefficient": 0.4071052198331735
                },
                {
                    "distanceM": 1200,
                    "timeS": 4.874157779431012,
                    "positionM": {
                        "x": 1200,
                        "y": -22.552351890230906,
                        "z": -8.09043197296905
                    },
                    "groundVelocityMps": {
                        "x": 109.7804923587127,
                        "y": -24.94149843608639,
                        "z": -5.855078035221961
                    },
                    "groundSpeedMps": 112.73028335614711,
                    "airspeedMps": 137.13146919211655,
                    "mach": 0.44774310848311283,
                    "dragCoefficient": 0.27379940772148764
                }
            ]
        },
        {
            "id": "hot-thin-tailwind-g7",
            "category": "environment",
            "projectile": {
                "id": "reference:hornady-g7-variant",
                "massKg": 0.01088621688,
                "muzzleVelocityMps": 822.96,
                "dragModel": "G7",
                "ballisticCoefficient": 0.24,
                "sphereDiameterM": 0,
                "materialDensityKgM3": 0,
                "dragReferenceDiameterM": 0,
                "machCdPoints": []
            },
            "atmosphere": {
                "temperatureC": 50,
                "stationPressureHpa": 650,
                "relativeHumidityPercent": 10,
                "headwindMps": -18,
                "crosswindMps": 0,
                "densityKgM3": 0.6956753892889715,
                "speedOfSoundMps": 361.44349730951865,
                "dynamicViscosityPaS": 0.000019534205964493487
            },
            "launch": {
                "elevationRad": 0.03,
                "azimuthRad": 0
            },
            "maximumDistanceM": 1600,
            "tolerances": {
                "positionAbsoluteM": 0.0005,
                "velocityAbsoluteMps": 0.005,
                "timeAbsoluteS": 0.000015,
                "scalarAbsolute": 0.005,
                "dragCoefficientAbsolute": 0.000002
            },
            "samples": [
                {
                    "distanceM": 100,
                    "timeS": 0.12430682715614104,
                    "positionM": {
                        "x": 100,
                        "y": 2.9247578383895574,
                        "z": 0
                    },
                    "groundVelocityMps": {
                        "x": 786.7595118691687,
                        "y": 22.394012290236432,
                        "z": 0
                    },
                    "groundSpeedMps": 787.0781545075864,
                    "airspeedMps": 769.0856121887717,
                    "mach": 2.127816983604972,
                    "dragCoefficient": 0.2905309809837017
                },
                {
                    "distanceM": 400,
                    "timeS": 0.5330000143142285,
                    "positionM": {
                        "x": 400,
                        "y": 10.667832319206001,
                        "z": 0
                    },
                    "groundVelocityMps": {
                        "x": 685.159487804196,
                        "y": 15.693869014161164,
                        "z": 0
                    },
                    "groundSpeedMps": 685.3392016022008,
                    "airspeedMps": 667.3440489670909,
                    "mach": 1.8463302118715867,
                    "dragCoefficient": 0.30808624347401625
                },
                {
                    "distanceM": 800,
                    "timeS": 1.1776114546073713,
                    "positionM": {
                        "x": 800,
                        "y": 17.898486058305224,
                        "z": 0
                    },
                    "groundVelocityMps": {
                        "x": 562.0338358993529,
                        "y": 7.069959732453656,
                        "z": 0
                    },
                    "groundSpeedMps": 562.0783015082145,
                    "airspeedMps": 544.0797725830124,
                    "mach": 1.5052968904766184,
                    "dragCoefficient": 0.3433219980189928
                },
                {
                    "distanceM": 1200,
                    "timeS": 1.9722412153116573,
                    "positionM": {
                        "x": 1200,
                        "y": 20.037696010715926,
                        "z": 0
                    },
                    "groundVelocityMps": {
                        "x": 450.8657243047872,
                        "y": -1.354611110800198,
                        "z": 0
                    },
                    "groundSpeedMps": 450.867759242266,
                    "airspeedMps": 432.86784386134474,